{
  "nome": "taverna",
  "larghezza": 15,
  "altezza": 10,
  "tipo": "interno",
  "descrizione": "Una taverna accogliente con un camino e molti avventori.",
  "backgroundImage": "assets/maps/taverna_background.png",
  "griglia": [
    [1, 1, 1, 1, 1, 1, 1, 1, 1, 1, 1, 1, 1, 1, 1],
    [1, 0, 0, 0, 0, 0, 0, 0, 0, 0, 0, 0, 0, 0, 1],
    [1, 0, 0, 0, 0, 0, 0, 0, 0, 0, 0, 0, 0, 0, 1],
    [1, 0, 0, 0, 0, 0, 0, 0, 0, 0, 0, 0, 0, 0, 1],
    [1, 0, 0, 0, 0, 0, 0, 0, 0, 0, 0, 0, 0, 0, 1],
    [1, 0, 0, 0, 0, 0, 0, 0, 0, 0, 0, 0, 0, 0, 1],
    [1, 0, 0, 0, 0, 0, 0, 0, 0, 0, 0, 0, 0, 0, 1],
    [1, 0, 0, 0, 0, 0, 0, 0, 0, 0, 0, 0, 0, 0, 1],
    [1, 0, 0, 0, 0, 0, 2, 0, 0, 0, 0, 0, 0, 0, 1],
    [1, 1, 1, 1, 1, 1, 1, 1, 1, 1, 1, 1, 1, 1, 1]
  ],
  "oggetti": {
    "[2, 2]": {"nome": "bancone", "tipo": "arredo", "sprite": "bancone"},
    "[9, 1]": {"nome": "camino", "tipo": "arredo", "sprite": "camino"},
    "[7, 5]": {"nome": "tavolo", "tipo": "arredo", "sprite": "tavolo"},
    "[6, 5]": {"nome": "sedia", "tipo": "arredo", "sprite": "sedia"},
    "[1, 1]": {"nome": "barile", "tipo": "container", "sprite": "barile"},
    "[13, 8]": {"nome": "scala", "tipo": "passaggio", "sprite": "scala"},
    "[13, 2]": {"nome": "porta_cantina", "tipo": "porta", "sprite": "porta_cantina"}
  },
  "npg": {
    "[6, 6]": {"nome": "Durnan", "tipo": "npc", "sprite": "npc"},
    "[8, 5]": {"nome": "Elminster", "tipo": "npc", "sprite": "vendor"},
    "[7, 7]": {"nome": "Mirt", "tipo": "npc", "sprite": "guard"}
  },
  "porte": {
    "[12, 5]": ["villaggio", [1, 5]]
  },
  "pos_iniziale_giocatore": [7, 5]
}